{
  "bidio": "0.2",
  "id": "93ee6e99-2227-460e-a090-9dc869b6ace2",
  "bid_id": "06680901-02a8-4f83-8c23-911bedcb4198",
  "conformance": "M1",
  "generator": { "name": "bidio-fixtures", "version": "0.2" },
  "created_at": "2026-07-11T18:00:00Z",
  "updated_at": "2026-07-11T18:00:00Z",
  "project": {
    "title": "Fixture Show 004 - Skyline",
    "code": "FIX004",
    "client": "Example Pictures",
    "kind": "feature"
  },
  "parties": {
    "vendor": { "name": "Example VFX Co", "country": "CA" }
  },
  "currency": "USD",
  "departments": [
    { "key": "comp", "label": "Compositing" },
    { "key": "fx", "label": "FX Simulation" }
  ],
  "rate_card": {
    "comp": 850,
    "fx": 1000
  },
  "shots": [
    {
      "id": "sh-010",
      "code": "010",
      "description": "Tower collapse, 2.5D projection with stock elements",
      "type": "fx",
      "difficulty": "medium",
      "quantity": 1,
      "efforts": { "comp": 5, "fx": 2 },
      "notes": "Lite scenario: projection cheat in place of full sim"
    },
    {
      "id": "sh-020",
      "code": "020",
      "description": "Aftermath street extension (reduced scope)",
      "type": "environment",
      "difficulty": "low",
      "quantity": 1,
      "efforts": { "comp": 2.5 }
    }
  ],
  "line_items": [
    {
      "id": "li-1",
      "label": "VFX supervision",
      "kind": "supervision",
      "quantity": 2,
      "unit": "day",
      "unit_cost": 1200
    }
  ],
  "incentives": [],
  "totals": {
    "shots_subtotal": 8375,
    "line_items_subtotal": 2400,
    "gross": 10775,
    "incentive_credit": 0,
    "net": 10775
  },
  "revision": { "number": 1, "variant": "lite", "locked": false, "supersedes": null },
  "award": { "status": "draft" },
  "extensions": {}
}
